{
  "$schema": "https://json-schema.org/draft/2020-12/schema",
  "$id": "adapter-v1.schema.json",
  "title": "SteamZero adapter manifest v1",
  "type": "object",
  "additionalProperties": false,
  "required": [
    "schemaVersion",
    "id",
    "kind",
    "platforms",
    "capabilities",
    "sources",
    "license",
    "upstream"
  ],
  "properties": {
    "schemaVersion": {
      "const": 1
    },
    "id": {
      "type": "string",
      "pattern": "^[a-z0-9][a-z0-9-]{0,62}$"
    },
    "kind": {
      "enum": [
        "emulator",
        "frontend",
        "tool",
        "core"
      ]
    },
    "platforms": {
      "type": "array",
      "items": {
        "type": "string",
        "pattern": "^[a-z0-9][a-z0-9-]{0,62}$"
      },
      "uniqueItems": true
    },
    "capabilities": {
      "type": "array",
      "minItems": 2,
      "uniqueItems": true,
      "items": {
        "enum": [
          "detect",
          "status",
          "install",
          "update",
          "configure",
          "verify",
          "repair",
          "uninstall",
          "backup",
          "restore"
        ]
      }
    },
    "enhancements": {
      "type": "object",
      "additionalProperties": false,
      "required": [
        "supplied",
        "formats"
      ],
      "properties": {
        "supplied": {
          "type": "array",
          "uniqueItems": true,
          "items": {
            "enum": [
              "mod",
              "cheat"
            ]
          }
        },
        "formats": {
          "type": "array",
          "uniqueItems": true,
          "items": {
            "type": "string",
            "pattern": "^[a-z0-9._-]+$"
          }
        }
      }
    },
    "sources": {
      "type": "array",
      "minItems": 1,
      "items": {
        "$ref": "#/$defs/source"
      }
    },
    "core": {
      "type": "object",
      "additionalProperties": false,
      "required": [
        "id",
        "sha256"
      ],
      "properties": {
        "id": {
          "type": "string",
          "pattern": "^[a-z0-9][a-z0-9_]*$"
        },
        "sha256": {
          "type": "string",
          "pattern": "^[a-f0-9]{64}$"
        }
      }
    },
    "paths": {
      "type": "object",
      "additionalProperties": {
        "type": "string"
      }
    },
    "configFormat": {
      "enum": [
        "ini",
        "json",
        "toml",
        "xml",
        "none"
      ]
    },
    "verify": {
      "type": "object",
      "additionalProperties": false,
      "required": [
        "smokeTest"
      ],
      "properties": {
        "smokeTest": {
          "type": "array",
          "minItems": 1,
          "items": {
            "type": "string",
            "minLength": 1
          }
        },
        "smokeMode": {
          "enum": [
            "application",
            "flatpak-info",
            "appimage-extract"
          ]
        },
        "smokeExitCodes": {
          "type": "array",
          "minItems": 1,
          "uniqueItems": true,
          "items": {
            "type": "integer"
          }
        },
        "smokeMatch": {
          "type": "string",
          "minLength": 1
        },
        "environment": {
          "type": "object",
          "propertyNames": {
            "pattern": "^[A-Z_][A-Z0-9_]{0,63}$"
          },
          "additionalProperties": {
            "type": "string",
            "maxLength": 256
          }
        }
      }
    },
    "launch": {
      "type": "object",
      "additionalProperties": false,
      "properties": {
        "arguments": {
          "type": "array",
          "minItems": 1,
          "maxItems": 16,
          "items": {
            "type": "string",
            "minLength": 1,
            "maxLength": 256
          },
          "description": "Argumentos atomicos allowlisted acrescentados ao executavel do adapter; nunca sao interpretados por shell."
        }
      }
    },
    "compat": {
      "type": "array",
      "uniqueItems": true,
      "items": {
        "type": "string",
        "pattern": "^[a-z0-9][a-z0-9-]{0,62}$"
      }
    },
    "conflicts": {
      "type": "array",
      "uniqueItems": true,
      "items": {
        "type": "string",
        "pattern": "^[a-z0-9][a-z0-9-]{0,62}$"
      }
    },
    "requires": {
      "type": "array",
      "uniqueItems": true,
      "items": {
        "type": "string",
        "pattern": "^[a-z0-9][a-z0-9-]{0,62}$"
      }
    },
    "requiresKeys": {
      "$ref": "#/$defs/keyRequirement"
    },
    "requiresFirmware": {
      "$ref": "#/$defs/firmwareRequirement"
    },
    "license": {
      "type": "string",
      "minLength": 1
    },
    "upstream": {
      "type": "string",
      "format": "uri"
    },
    "notes": {
      "type": "string"
    },
    "presentation": {
      "type": "object",
      "additionalProperties": false,
      "description": "Como o adapter se apresenta na UI. Vive aqui, versionado, e não num dict Python paralelo ao manifesto: apresentação hardcoded é allowlist implícita e faz emulador declarado aparecer sem nome nem ícone.",
      "required": [
        "displayName",
        "iconAsset"
      ],
      "properties": {
        "displayName": {
          "type": "string",
          "minLength": 1,
          "maxLength": 64
        },
        "iconAsset": {
          "type": "string",
          "pattern": "^\\.\\./assets/[a-z0-9][a-z0-9.-]*\\.(svg|png)$",
          "description": "Caminho relativo de asset EMPACOTADO. A resolução em runtime é allowlisted por PackagedAssets.qml; valor fora da lista não carrega."
        }
      }
    }
  },
  "$defs": {
    "keyRequirement": {
      "type": "object",
      "additionalProperties": false,
      "required": [
        "platform",
        "keyset"
      ],
      "properties": {
        "platform": {
          "type": "string",
          "pattern": "^[a-z0-9][a-z0-9-]{0,62}$"
        },
        "keyset": {
          "enum": [
            "prod",
            "title",
            "dev"
          ]
        },
        "minimumKeyRevision": {
          "type": "integer",
          "minimum": 0,
          "maximum": 255
        }
      }
    },
    "firmwareRequirement": {
      "type": "object",
      "additionalProperties": false,
      "required": [
        "platform"
      ],
      "properties": {
        "platform": {
          "type": "string",
          "pattern": "^[a-z0-9][a-z0-9-]{0,62}$"
        },
        "minimumVersion": {
          "type": "string",
          "pattern": "^[0-9]{1,3}(\\.[0-9]{1,3}){0,3}$"
        }
      }
    },
    "source": {
      "type": "object",
      "additionalProperties": false,
      "required": [
        "type",
        "version",
        "priority"
      ],
      "properties": {
        "type": {
          "enum": [
            "flatpak",
            "appimage",
            "native",
            "archive"
          ]
        },
        "version": {
          "type": "string",
          "minLength": 1,
          "maxLength": 128,
          "pattern": "^[A-Za-z0-9][A-Za-z0-9._+-]{0,127}$"
        },
        "priority": {
          "type": "integer",
          "minimum": 1
        },
        "ref": {
          "type": "string",
          "minLength": 1
        },
        "remote": {
          "type": "string",
          "minLength": 1
        },
        "url": {
          "type": "string",
          "format": "uri"
        },
        "sha256": {
          "type": "string",
          "pattern": "^[a-f0-9]{64}$"
        },
        "endOfLife": {
          "type": "boolean"
        },
        "payloadPath": {
          "type": "string",
          "minLength": 1,
          "maxLength": 256,
          "description": "Membro unico dentro do artefato zipado que se torna o payload executavel. O sha256 declarado continua sendo o do artefato inteiro."
        }
      },
      "allOf": [
        {
          "if": {
            "properties": {
              "type": {
                "const": "flatpak"
              }
            }
          },
          "then": {
            "required": [
              "ref",
              "remote"
            ]
          },
          "else": {
            "required": [
              "url"
            ]
          }
        },
        {
          "if": {
            "required": [
              "payloadPath"
            ],
            "properties": {
              "type": {
                "const": "flatpak"
              }
            }
          },
          "then": false
        }
      ]
    }
  }
}
