{
  "schemaVersion": 1,
  "id": "eden",
  "kind": "emulator",
  "presentation": {
    "displayName": "Eden",
    "iconAsset": "../assets/eden.svg"
  },
  "platforms": [
    "switch"
  ],
  "capabilities": [
    "detect",
    "status",
    "install",
    "update",
    "configure",
    "verify",
    "repair",
    "uninstall",
    "backup",
    "restore"
  ],
  "sources": [
    {
      "type": "appimage",
      "version": "0.2.1-steamdeck",
      "priority": 1,
      "url": "https://stable.eden-emu.dev/v0.2.1/Eden-Linux-v0.2.1-steamdeck-clang-pgo.AppImage",
      "sha256": "5cc5b358ac6449b40021b20ba2430b4d12302737db15c8cbe5b46ce9aab85ce5"
    }
  ],
  "configFormat": "ini",
  "verify": {
    "smokeTest": [
      "--appimage-version"
    ]
  },
  "requiresKeys": {
    "platform": "switch",
    "keyset": "prod"
  },
  "requiresFirmware": {
    "platform": "switch"
  },
  "license": "GPL-3.0-or-later",
  "upstream": "https://git.eden-emu.dev/eden-emu/eden",
  "notes": "AppImage oficial otimizado para Steam Deck, fixado por SHA-256."
}
