{
  "schemaVersion": 1, "id": "libretro-puae", "kind": "core", "presentation": {"displayName": "Libretro: PUAE", "iconAsset": "../assets/retroarch.svg"}, "platforms": ["amiga"],
  "capabilities": ["detect", "status", "install", "update", "verify", "repair", "uninstall"],
  "sources": [{"type": "archive", "version": "1.22.2", "priority": 1, "url": "https://buildbot.libretro.com/stable/1.22.2/linux/x86_64/RetroArch_cores.7z", "sha256": "4b7ed8dc97d4bf035fce182c64b5658c7662e2e9e5d42129538afbd4b6096307"}],
  "core": {"id": "puae", "sha256": "ebfb55ca1e909bffdb0d9c133d619f998e20c4aa0a7e05c1e481da93a286ce8c"}, "requires": ["retroarch"], "license": "GPL-2.0-only", "upstream": "https://github.com/libretro/libretro-uae", "verify": {"smokeTest": ["core-present"]}
}
