{
  "schemaVersion": 1, "id": "libretro-opera", "kind": "core", "presentation": {"displayName": "Libretro: Opera", "iconAsset": "../assets/retroarch.svg"}, "platforms": ["three-do"],
  "capabilities": ["detect", "status", "install", "update", "verify", "repair", "uninstall"],
  "sources": [{"type": "archive", "version": "1.22.2", "priority": 1, "url": "https://buildbot.libretro.com/stable/1.22.2/linux/x86_64/RetroArch_cores.7z", "sha256": "4b7ed8dc97d4bf035fce182c64b5658c7662e2e9e5d42129538afbd4b6096307"}],
  "core": {"id": "opera", "sha256": "7fc25dc0f352f07a718aa1154bc463554ca483f1b13a4e0452ad4f46c61e9b11"}, "requires": ["retroarch"], "license": "LGPL-2.1-or-later", "upstream": "https://www.libretro.com/", "verify": {"smokeTest": ["core-present"]}
}
