{
  "schemaVersion": 1, "id": "libretro-mednafen-vb", "kind": "core", "presentation": {"displayName": "Libretro: Mednafen VB", "iconAsset": "../assets/retroarch.svg"}, "platforms": ["virtual-boy"],
  "capabilities": ["detect", "status", "install", "update", "verify", "repair", "uninstall"],
  "sources": [{"type": "archive", "version": "1.22.2", "priority": 1, "url": "https://buildbot.libretro.com/stable/1.22.2/linux/x86_64/RetroArch_cores.7z", "sha256": "4b7ed8dc97d4bf035fce182c64b5658c7662e2e9e5d42129538afbd4b6096307"}],
  "core": {"id": "mednafen_vb", "sha256": "4e118d8523811dfa0bd9d22934a3d686448d43d91347af4e0a35b2782e787dbe"}, "requires": ["retroarch"], "license": "Multiple licenses; see upstream", "upstream": "https://www.libretro.com/", "verify": {"smokeTest": ["core-present"]}
}
