{
  "schemaVersion": 1,
  "id": "azahar",
  "kind": "emulator",
  "presentation": {
    "displayName": "Azahar",
    "iconAsset": "../assets/azahar.svg"
  },
  "platforms": [
    "nintendo-3ds"
  ],
  "capabilities": [
    "detect",
    "status",
    "install",
    "update",
    "uninstall",
    "configure",
    "verify",
    "repair",
    "backup",
    "restore"
  ],
  "sources": [
    {
      "type": "flatpak",
      "ref": "org.azahar_emu.Azahar",
      "remote": "flathub",
      "version": "fd0b3050e4da6a7df8915f63fb8c1d551c7ca8c684568dc62c1681fd316a288c",
      "priority": 1
    }
  ],
  "verify": {
    "smokeTest": [
      "--version"
    ]
  },
  "compat": [
    "steamos",
    "bazzite",
    "linux"
  ],
  "license": "GPL-2.0-or-later",
  "upstream": "https://github.com/azahar-emu/azahar",
  "notes": "Fonte Flathub fixada no commit correspondente à versão 2125.1.1."
}
